{
  "version": "0.2",
  "canonical_issue": "example-org/example-project#42",
  "commit_sha": "0123456789abcdef0123456789abcdef01234567",
  "run_id": "example-run-001",
  "observed_at": "2026-10-12T00:00:00Z",
  "checks": [
    {
      "name": "unit",
      "command": "just test",
      "exit_code": 0,
      "artifact_url": null
    }
  ],
  "notes": "Demonstration only, not independent CI attestation."
}
